[
    {
        "site": "Right dorsolateral bladder wall",
        "laterality": "Right",
        "histology": "High grade muscle invasive urothelial cell carcinoma +CIS",
        "stage": "T3aN0Mx",
        "grade": "III",
        "behavior": "Malignant",
        "pdf_file_name_path": "TCGA-2F-A9KO.FA1D30C7-E486-48DD-989F-E774B42EA1B1.PDF",
        "ocr_text": "UUID:FA1D30C7-E486-48DD-989F-E774B42EA1B1\nTCGA-2F-A9KO- 61A-PRRedacted\nIII IIIIIIIIIIIIIIIIIIIIIIIIIIIIIIIIIIIIIIIIIII IIIIIN IIIIIIIIIIIIIII I I IH I!IIII I IIIIIII I IIIIIIII II !IIIIIIIIIIII Ili, l I I !III IIIIII IIIIIIIIIIIIIIIIIIIIIIIIIIIIIIIIIIIIIIIIIIIII IIIIIIIIIIIIII\nPathology report\nDate of tumor procurement\nDate of report3c^&,-vadzim, ..&\nHistologic diagnosis\nHigh grade muscle invasive urothelial cell carcinoma +CIS. T3aNOMx\nAnatomic site and laterality\nRight dorsolateral bladder wall\nTumor size\n2.5cm diameter\nLymph node status\nA total of 18 lymph nodes all without tumor localization9tL) l/z9/ly\ncriteria ,Li/z/io/iDiagnos sDiscrepancy\nPrimary Tumor Site Tiscrepancy\nH IPAA Discrepan y\nPrior Malignancy HistoryYas No\n11s\nReviewer Imtiais r+.e previewed:Dual/Synchronous Primary\nCase is (circle ): UALIFifDISQUALIFIED",
        "llm_output": " 1. \"Site\": Right dorsolateral bladder wall. Justification: The report specifically mentioned the location of the tumor.\n2. \"Laterality\": Right. Justification: The report clearly states that the tumor is located on the right dorsolateral bladder wall.\n3. \"Histology\": High grade muscle invasive urothelial cell carcinoma +CIS. Justification: The report clearly identifies the type of cancer as high grade muscle invasive urothelial cell carcinoma +CIS.\n4. \"Stage\": T3aN0Mx. Justification: The tumor has invaded the subepithelial connective tissue (T3a), there is no regional lymph node metastasis (N0), and no distant metastasis (Mx) based on the report.\n5. \"Grade\": III. Justification: The report describes the tumor as high grade, which corresponds to Grade III in the given scale.\n6. \"Behavior\": Malignant. Justification: The tumor is a high grade muscle invasive urothelial cell carcinoma, indicating malignant behavior."
    },
    {
        "site": "Right dorsolateral bladder wall",
        "laterality": "Right",
        "histology": "High grade muscle invasive urothelial cell carcinoma",
        "stage": "T3aN2Mx",
        "grade": "III",
        "behavior": "Malignant",
        "pdf_file_name_path": "TCGA-2F-A9KP.19580F74-7FD9-4366-9FFB-D66D2BC33336.PDF",
        "ocr_text": "UUID:19580F74-7FD9.4366 -9FFB-D66D2BC33336\nTCGA-2F-A9KP -91A-PR Redacted\nIII IIIIIIIIIIIIIIIIIIIIIIIIIIIIIIIIIIIIIIIIIIIIIIIIIIIIIIIIIIIIIIII1111111 IIIIIIII I IIIIIIIIIIIIII I III I IIIIIIIIIII III II III IIIIII IIIIIIIIIIIIIIIIIIIIIIIIIIIIIIIIIMIIIIIIIIIIIIIIII IIIIIIII\nPathology report\nDate of tumor procurement\nDate of report\nHistologic diagnosis\nHigh grade muscle invasive urothelial cell carcinoma, T3aN2Mx\nAnatomic site and laterality\nRight dorsolateral bladder wall\nTumor size\n3.5cm diameter\nLymph node statusLib_A44\n12(p7, Q_\n91^,Izgl^y\nA total of 21 lymph nodes, in 2 right iliac lymph nodes metastasis of urothelial cell carcinoma (0.8cm +\n1cm) with extra-nodal growth\nCriteria aDiagnosis Discrep cy i\nPrimary Tumor Site Discrepancy\n\"I FAA Discrepancy\nPrior Malignancy History\nUse is circle);\nReviewer InitialsDual/Synchronous Primary\nQUA0\nDate Reviewed:/z\n/ DISQUALIFIED",
        "llm_output": " 1. \"Site\": Right dorsolateral bladder wall. Justification: The report specifically mentioned the location as the right dorsolateral bladder wall.\n2. \"Laterality\": Right. Justification: The site is specified as the right dorsolateral bladder wall, indicating the laterality as right.\n3. \"Histology\": High grade muscle invasive urothelial cell carcinoma. Justification: The report diagnosed the tumor as high grade muscle invasive urothelial cell carcinoma.\n4. \"Stage\": T3aN2Mx. Justification: The tumor has invaded the subserosa (T3a), there are metastases in 2 out of 21 lymph nodes (N2), and no distant metastasis was found (M0).\n5. \"Grade\": III. Justification: The report mentioned high grade, which corresponds to Grade III in the given scale.\n6. \"Behavior\": Malignant. Justification: The tumor is diagnosed as a cancer (a malignant condition) and has invaded the surrounding tissues (muscle invasion)."
    }
]